{
  "schemaId": "current-base-server-content-v1",
  "manifestType": "current-base-server-content",
  "contentId": "current-base-public-content-v1",
  "variantId": "current-base-v1",
  "configurationEntry": "current-base.conf",
  "connectionsEntry": "connections.conf",
  "definitionsRoot": "conf/server",
  "definitionLimits": {
    "boundaryMaxId": 213,
    "itemMaxId": 1592,
    "npcMaxId": 835,
    "sceneryMaxId": 1295
  },
  "sourceFiles": [
    {"sourcePath":"current-platform/runtime/current-base-v1/public-definitions/combat-policy.json","bundlePath":"conf/server/current-base-public-provenance/combat-policy.json","transform":"copy"},
    {"sourcePath":"current-platform/runtime/current-base-v1/public-definitions/skill-policy.json","bundlePath":"conf/server/current-base-public-provenance/skill-policy.json","transform":"copy"},
    {"sourcePath":"current-platform/runtime/current-base-v1/public-definitions/provenance.json","bundlePath":"conf/server/current-base-public-provenance/provenance.json","transform":"copy"},
    {"sourcePath":"current-platform/runtime/current-base-v1/public-definitions/gameplay-provenance.json","bundlePath":"conf/server/current-base-public-provenance/gameplay-provenance.json","transform":"copy"},
    {"sourcePath":"current-platform/runtime/current-base-v1/public-definitions/visual-provenance.json","bundlePath":"conf/server/current-base-public-provenance/visual-provenance.json","transform":"copy"},
    {"sourcePath":"current-platform/runtime/current-base-v1/public-definitions/effective-policy.json","bundlePath":"conf/server/current-base-public-provenance/effective-policy.json","transform":"copy"},
    {"sourcePath": "server/alertwords.txt", "bundlePath": "alertwords.txt", "transform": "copy"},
    {"sourcePath": "server/badwords.txt", "bundlePath": "badwords.txt", "transform": "copy"},
    {"sourcePath": "server/goodwords.txt", "bundlePath": "goodwords.txt", "transform": "copy"},
    {"sourcePath": "server/globalrules.txt", "bundlePath": "globalrules.txt", "transform": "copy"},
    {"sourcePath": "server/database/sql_queries.xsd", "bundlePath": "database/sql_queries.xsd", "transform": "copy"},
    {"sourcePath": "server/database/mysql/queries/bank_presets.xml", "bundlePath": "database/mysql/queries/bank_presets.xml", "transform": "copy"},
    {"sourcePath": "server/database/mysql/queries/item.xml", "bundlePath": "database/mysql/queries/item.xml", "transform": "copy"},
    {"sourcePath": "server/database/mysql/queries/patches.xml", "bundlePath": "database/mysql/queries/patches.xml", "transform": "copy"},
    {"sourcePath": "server/database/mysql/queries/player.xml", "bundlePath": "database/mysql/queries/player.xml", "transform": "copy"},
    {"sourcePath": "server/database/sqlite/queries/bank_presets.xml", "bundlePath": "database/sqlite/queries/bank_presets.xml", "transform": "copy"},
    {"sourcePath": "server/database/sqlite/queries/item.xml", "bundlePath": "database/sqlite/queries/item.xml", "transform": "copy"},
    {"sourcePath": "server/database/sqlite/queries/patches.xml", "bundlePath": "database/sqlite/queries/patches.xml", "transform": "copy"},
    {"sourcePath": "server/database/sqlite/queries/player.xml", "bundlePath": "database/sqlite/queries/player.xml", "transform": "copy"},
    {"sourcePath": "server/database/sqlite/patches/.gitsave", "bundlePath": "database/sqlite/patches/.gitsave", "transform": "copy"},
    {"sourcePath": "server/database/sqlite/patches/2021_05_11_add_db_patches.sql", "bundlePath": "database/sqlite/patches/2021_05_11_add_db_patches.sql", "transform": "copy"},
    {"sourcePath": "server/database/sqlite/patches/2023_02_01_former_names.sql", "bundlePath": "database/sqlite/patches/2023_02_01_former_names.sql", "transform": "copy"},
    {"sourcePath": "server/database/sqlite/patches/2026_05_14_add_summoning_skill.sql", "bundlePath": "database/sqlite/patches/2026_05_14_add_summoning_skill.sql", "transform": "copy"},
    {"sourcePath": "server/database/sqlite/patches/2026_08_03_add_blessing_skill.sql", "bundlePath": "database/sqlite/patches/2026_08_03_add_blessing_skill.sql", "transform": "copy"},
    {"sourcePath": "server/database/mysql/patches/2020_09_23_rsc235.sql", "bundlePath": "database/mysql/patches/2020_09_23_rsc235.sql", "transform": "copy"},
    {"sourcePath": "server/database/mysql/patches/2020_10_28_player_transfers.sql", "bundlePath": "database/mysql/patches/2020_10_28_player_transfers.sql", "transform": "copy"},
    {"sourcePath": "server/database/mysql/patches/2021_03_14_xp_rollover.sql", "bundlePath": "database/mysql/patches/2021_03_14_xp_rollover.sql", "transform": "copy"},
    {"sourcePath": "server/database/mysql/patches/2021_03_24_message_logging_length.sql", "bundlePath": "database/mysql/patches/2021_03_24_message_logging_length.sql", "transform": "copy"},
    {"sourcePath": "server/database/mysql/patches/2021_05_11_add_db_patches.sql", "bundlePath": "database/mysql/patches/2021_05_11_add_db_patches.sql", "transform": "copy"},
    {"sourcePath": "server/database/mysql/patches/2021_05_27_move_ironman_to_separate_table.sql", "bundlePath": "database/mysql/patches/2021_05_27_move_ironman_to_separate_table.sql", "transform": "copy"},
    {"sourcePath": "server/database/mysql/patches/2021_05_28_delete_bank_size_from_players.sql", "bundlePath": "database/mysql/patches/2021_05_28_delete_bank_size_from_players.sql", "transform": "copy"},
    {"sourcePath": "server/database/mysql/patches/2023_02_01_former_names.sql", "bundlePath": "database/mysql/patches/2023_02_01_former_names.sql", "transform": "copy"},
    {"sourcePath": "server/database/mysql/patches/2023_12_23_change_itemid_to_bigint.sql", "bundlePath": "database/mysql/patches/2023_12_23_change_itemid_to_bigint.sql", "transform": "copy"},
    {"sourcePath": "server/database/mysql/patches/2026_05_14_add_summoning_skill.sql", "bundlePath": "database/mysql/patches/2026_05_14_add_summoning_skill.sql", "transform": "copy"},
    {"sourcePath": "server/database/mysql/patches/2026_08_03_add_blessing_skill.sql", "bundlePath": "database/mysql/patches/2026_08_03_add_blessing_skill.sql", "transform": "copy"},
    {"sourcePath": "server/conf/server/aliases.xml", "bundlePath": "conf/server/aliases.xml", "transform": "copy"},
    {"sourcePath": "server/conf/server/badwordsJag.txt", "bundlePath": "conf/server/badwordsJag.txt", "transform": "copy"},
    {"sourcePath": "server/conf/server/fonts/runescape_uf.ttf", "bundlePath": "conf/server/fonts/runescape_uf.ttf", "transform": "copy"},
    {"sourcePath": "server/conf/server/log4j2.xml", "bundlePath": "conf/server/log4j2.xml", "transform": "copy"},
    {"sourcePath": "server/conf/server/words.list", "bundlePath": "conf/server/words.list", "transform": "copy"},
    {"sourcePath": "server/conf/server/wordsJag.txt", "bundlePath": "conf/server/wordsJag.txt", "transform": "copy"},
    {"sourcePath": "server/conf/server/languages/AuthenticMessages_en_UK.properties", "bundlePath": "conf/server/languages/AuthenticMessages_en_UK.properties", "transform": "copy"},
    {"sourcePath": "server/conf/server/languages/AuthenticMessages_en_UK_female.properties", "bundlePath": "conf/server/languages/AuthenticMessages_en_UK_female.properties", "transform": "copy"},
    {"sourcePath": "server/conf/server/languages/AuthenticMessages_en_UK_female_no_misgender.properties", "bundlePath": "conf/server/languages/AuthenticMessages_en_UK_female_no_misgender.properties", "transform": "copy"},
    {"sourcePath": "server/conf/server/languages/AuthenticMessages_en_UK_gender_neutral.properties", "bundlePath": "conf/server/languages/AuthenticMessages_en_UK_gender_neutral.properties", "transform": "copy"},
    {"sourcePath": "server/conf/server/languages/AuthenticMessages_en_UK_male.properties", "bundlePath": "conf/server/languages/AuthenticMessages_en_UK_male.properties", "transform": "copy"},
    {"sourcePath": "current-platform/runtime/current-base-v1/public-definitions/ItemDefsCustom.json", "bundlePath": "conf/server/defs/ItemDefsCustom.json", "transform": "copy"},
    {"sourcePath": "current-platform/runtime/current-base-v1/public-definitions/NpcDefsCustom.json", "bundlePath": "conf/server/defs/NpcDefsCustom.json", "transform": "copy"},
    {"sourcePath": "current-platform/runtime/current-base-v1/public-definitions/ItemDefs.json", "bundlePath": "conf/server/defs/ItemDefs.json", "transform": "copy"},
    {"sourcePath": "current-platform/runtime/current-base-v1/public-definitions/NpcDefs.json", "bundlePath": "conf/server/defs/NpcDefs.json", "transform": "copy"},
    {"sourcePath": "current-platform/runtime/current-base-v1/public-definitions/DoorDef.xml", "bundlePath": "conf/server/defs/DoorDef.xml", "transform": "copy"},
    {"sourcePath": "current-platform/runtime/current-base-v1/public-definitions/GameObjectDef.xml", "bundlePath": "conf/server/defs/GameObjectDef.xml", "transform": "copy"},
    {"sourcePath": "current-platform/runtime/current-base-v1/public-definitions/PrayerDef.xml", "bundlePath": "conf/server/defs/PrayerDef.xml", "transform": "copy"},
    {"sourcePath": "current-platform/runtime/current-base-v1/public-definitions/SpellDef.xml", "bundlePath": "conf/server/defs/SpellDef.xml", "transform": "copy"},
    {"sourcePath": "current-platform/runtime/current-base-v1/public-definitions/TileDef.xml", "bundlePath": "conf/server/defs/TileDef.xml", "transform": "standard-floors-v1"},
    {"sourcePath": "current-platform/runtime/current-base-v1/public-definitions/extras/FiremakingDef.xml", "bundlePath": "conf/server/defs/extras/FiremakingDef.xml", "transform": "copy"},
    {"sourcePath": "current-platform/runtime/current-base-v1/public-definitions/extras/ItemAffectedTypes.xml", "bundlePath": "conf/server/defs/extras/ItemAffectedTypes.xml", "transform": "copy"},
    {"sourcePath": "current-platform/runtime/current-base-v1/public-definitions/extras/ItemArrowHeadDef.xml", "bundlePath": "conf/server/defs/extras/ItemArrowHeadDef.xml", "transform": "copy"},